{
  "$schema": "../schemas/neuroartan-localization-catalog.schema.json",
  "language": "en",
  "direction": "ltr",
  "sourceLanguage": "en",
  "entries": {
    "404.actions.back": "Back",
    "404.actions.home": "Home",
    "404.body.1": "This page is intentionally routed here while Neuroartan quietly develops the next public layers of the platform and institutional website.",
    "404.body.2": "Please continue through the currently active public surfaces until additional sections are formally released.",
    "404.heading": "This destination is under active development.",
    "404.meta.description": "This destination is intentionally unavailable while Neuroartan is under active development and selected public sections are being prepared.",
    "404.meta.title": "Page Not Found · Neuroartan",
    "about_featured_functions_controls_aria_label": "Featured functions controls",
    "about_featured_functions_next_aria_label": "Next featured function",
    "about_featured_functions_pagination_aria_label": "Featured functions pagination",
    "about_featured_functions_previous_aria_label": "Previous featured function",
    "about_featured_functions_section_description": "A modular overview of the core ICOS capabilities shaping reflective cognition, continuity, and long-term user development.",
    "about_featured_functions_section_title": "Featured Functions",
    "account_drawer_continue_with_apple": "Continue with Apple",
    "account_drawer_continue_with_email": "Continue with email",
    "account_drawer_continue_with_google": "Continue with Google",
    "account_drawer_continue_with_phone": "Continue with phone number",
    "account_drawer_legal_connector": "and",
    "account_drawer_legal_middle_prefix": "For more information about",
    "account_drawer_legal_middle_suffix": "’s data practices, please review the",
    "account_drawer_legal_prefix": "By creating an account, you agree to the",
    "account_drawer_legal_suffix": "We may occasionally send you account-related emails.",
    "account_drawer_need_help": "Need help?",
    "account_drawer_privacy_policy": "Privacy Policy",
    "account_drawer_privacy_policy_statement": "Privacy Policy Statement",
    "account_drawer_profile_badge": "Profile",
    "account_drawer_profile_copy_prefix": "This surface is reserved for your profile state, account continuity, and future authenticated access across the",
    "account_drawer_profile_copy_suffix": "environment.",
    "account_drawer_profile_note": "Once authentication and profile logic are live, this layer will transition from entry state to private account continuity.",
    "account_drawer_profile_placeholder_prefix": "Your private",
    "account_drawer_profile_placeholder_suffix": "profile will appear here.",
    "account_drawer_sign_in": "Sign in",
    "account_drawer_terms_of_use": "Terms of Use",
    "account_email_auth_already_have_account": "Already have an account? Sign in",
    "account_email_auth_email_placeholder": "Email address",
    "account_email_auth_submit": "Continue with email",
    "account_forgot_password_email_placeholder": "Email or username",
    "account_forgot_password_submit": "Send reset link",
    "account_phone_auth_already_have_account": "Already have an account? Sign in",
    "account_phone_auth_submit": "Continue with phone",
    "account_profile_setup_display_name_note": "This is the name people will see on your profile.",
    "account_profile_setup_display_name_placeholder": "Display name",
    "account_profile_setup_dob_note": "Used for eligibility and kept private by default.",
    "account_profile_setup_first_name_placeholder": "First name",
    "account_profile_setup_gender_man": "Man",
    "account_profile_setup_gender_note": "Optional and kept private by default.",
    "account_profile_setup_gender_placeholder": "Optional",
    "account_profile_setup_gender_woman": "Woman",
    "account_profile_setup_last_name_placeholder": "Last name",
    "account_profile_setup_password_confirm_placeholder": "Reenter password",
    "account_profile_setup_password_placeholder": "Password",
    "account_profile_setup_skip": "Skip and set up later",
    "account_profile_setup_submit": "Complete profile",
    "account_profile_setup_username_note": "Your public profile will use this handle.",
    "account_profile_setup_username_placeholder": "Username",
    "account_segment_title_create_account": "Create an account",
    "account_segment_title_email": "Continue with Email",
    "account_segment_title_forgot_password": "Forgot password",
    "account_segment_title_phone": "Continue with Phone",
    "account_segment_title_profile_setup": "Profile setup",
    "account_segment_title_sign_in": "Sign in",
    "account_segment_title_sign_up": "Sign Up",
    "account_sign_in_continue_with_apple": "Continue with Apple",
    "account_sign_in_continue_with_google": "Continue with Google",
    "account_sign_in_divider_or": "or",
    "account_sign_in_forgot_password": "Forgot password?",
    "account_sign_in_identity_placeholder": "Email, username, or phone number",
    "account_sign_in_password_placeholder": "Password",
    "account_sign_in_submit": "Continue",
    "account_sign_up_continue_with_apple": "Continue with Apple",
    "account_sign_up_continue_with_email": "Continue with email",
    "account_sign_up_continue_with_google": "Continue with Google",
    "account_sign_up_continue_with_phone": "Continue with phone number",
    "account_sign_up_divider_or": "or",
    "account_sign_up_email_placeholder": "Email address",
    "account_sign_up_have_account": "Already have an account?",
    "account_sign_up_name_placeholder": "Full name",
    "account_sign_up_password_placeholder": "Create password",
    "account_sign_up_submit": "Create account",
    "cookieConsent.actions.allowAll": "Allow all cookies",
    "cookieConsent.actions.declineAll": "Decline optional cookies",
    "cookieConsent.actions.saveChoices": "Save preferences",
    "cookieConsent.alwaysActive": "Always active",
    "cookieConsent.analytics.detail": "These cookies help us measure performance and improve the website. They are optional.",
    "cookieConsent.analytics.performance.copy": "Helps measure speed, loading, and reliability.",
    "cookieConsent.analytics.performance.title": "Performance measurement",
    "cookieConsent.analytics.summary": "Helps us understand how the website performs.",
    "cookieConsent.analytics.title": "Analytics",
    "cookieConsent.analytics.usage.copy": "Helps identify useful sections and areas that need improvement.",
    "cookieConsent.analytics.usage.title": "Usage insights",
    "cookieConsent.copy": "We use cookies to keep Neuroartan secure, remember essential settings, and improve the experience when you allow it.",
    "cookieConsent.education.whatAreCookies.copy": "Cookies help websites remember settings, protect sessions, and support selected functions.",
    "cookieConsent.education.whatAreCookies.detail.intro": "Cookies are small data files that help a website remember settings, maintain security, and work correctly.",
    "cookieConsent.education.whatAreCookies.detail.point1.copy": "Some cookies are required. Others are optional and only used with your consent.",
    "cookieConsent.education.whatAreCookies.detail.point1.title": "Different cookies have different roles",
    "cookieConsent.education.whatAreCookies.detail.point2.copy": "They may remember language, privacy choices, or session state.",
    "cookieConsent.education.whatAreCookies.detail.point2.title": "They remember selected settings",
    "cookieConsent.education.whatAreCookies.detail.point3.copy": "Neuroartan separates required cookies from optional ones so your choices remain clear.",
    "cookieConsent.education.whatAreCookies.detail.point3.title": "Optional cookies are your choice",
    "cookieConsent.education.whatAreCookies.title": "What are cookies?",
    "cookieConsent.education.whyWeUseThem.copy": "We use them for security, core functionality, and optional improvement insights.",
    "cookieConsent.education.whyWeUseThem.detail.intro": "We use cookies to keep Neuroartan secure, remember consent choices, and improve the website when allowed.",
    "cookieConsent.education.whyWeUseThem.detail.point1.copy": "Required cookies help protect the website and keep key flows reliable.",
    "cookieConsent.education.whyWeUseThem.detail.point1.title": "Security",
    "cookieConsent.education.whyWeUseThem.detail.point2.copy": "Required cookies keep sessions, consent choices, and basic interface behavior working.",
    "cookieConsent.education.whyWeUseThem.detail.point2.title": "Core functionality",
    "cookieConsent.education.whyWeUseThem.detail.point3.copy": "Optional cookies help us understand performance and improve the experience.",
    "cookieConsent.education.whyWeUseThem.detail.point3.title": "Optional improvement",
    "cookieConsent.education.whyWeUseThem.title": "Why we use them",
    "cookieConsent.essential.detail": "These cookies keep the website secure, stable, and functional. They cannot be disabled.",
    "cookieConsent.essential.integrity.copy": "Keeps language, consent, and basic interface settings stable.",
    "cookieConsent.essential.integrity.title": "Interface integrity",
    "cookieConsent.essential.security.copy": "Helps protect the website from misuse and harmful activity.",
    "cookieConsent.essential.security.title": "Security & abuse prevention",
    "cookieConsent.essential.session.copy": "Keeps essential website sessions working as expected.",
    "cookieConsent.essential.session.title": "Session continuity",
    "cookieConsent.essential.summary": "Required for security, accessibility, and core website functions.",
    "cookieConsent.essential.title": "Essential",
    "cookieConsent.essentialNote": "Necessary cookies are always active. Optional cookies are your choice.",
    "cookieConsent.experience.continuity.copy": "Supports smoother return visits.",